{
  "$schema": "https://json-schema.org/draft/2020-12/schema",
  "title": "ExtractedSalesOrder",
  "type": "object",
  "additionalProperties": false,
  "required": ["po_number", "po_date", "customer_name", "currency", "lines"],
  "properties": {
    "po_number": {"type": "string"},
    "po_date": {"type": "string", "description": "ISO date YYYY-MM-DD"},
    "customer_name": {"type": "string"},
    "customer_email": {"type": "string"},
    "ship_to_address": {"type": "string"},
    "required_by": {"type": ["string", "null"], "description": "ISO date or null"},
    "payment_terms": {"type": ["string", "null"]},
    "currency": {"type": "string", "description": "ISO 4217"},
    "stated_subtotal": {"type": ["number", "null"], "description": "Subtotal as written on the PO, ex tax"},
    "notes": {"type": ["string", "null"]},
    "lines": {
      "type": "array",
      "minItems": 1,
      "items": {
        "type": "object",
        "additionalProperties": false,
        "required": ["sku", "description", "quantity", "unit_price"],
        "properties": {
          "line_no": {"type": "integer"},
          "sku": {"type": "string"},
          "description": {"type": "string"},
          "quantity": {"type": "number"},
          "uom": {"type": "string"},
          "unit_price": {"type": "number"}
        }
      }
    }
  }
}
